{
  "dimension": "minecraft:overworld",
  "dialogue": "ebb:demo/stairwell_dust_dialogue",
  "blocks": [
    [
      12,
      64,
      6
    ],
    [
      12,
      65,
      6
    ]
  ],
  "interaction_point": [
    12.5,
    64.4,
    6.5
  ],
  "highlight": {
    "color": "#7ad9ff",
    "opacity": 0.45,
    "render_mode": "merged",
    "priority": 80
  }
}
