{
  "dimension": "minecraft:overworld",
  "dialogue": "ebb:demo/guestbook_torn_page_dialogue",
  "blocks": [
    [
      4,
      64,
      8
    ]
  ],
  "interaction_point": [
    4.5,
    64.6,
    8.5
  ],
  "highlight": {
    "color": "#7ad9ff",
    "opacity": 0.45,
    "render_mode": "merged",
    "priority": 80
  }
}
